{
  "feature_id": "FEAT-0001",
  "raw_requirement": "做一个智能故事生成系统，支持多维度参数、分层生成、QA检测、编辑能力",
  "selected_solution": {
    "id": "solution_3",
    "name": "编辑主导的人机共创写作台",
    "reason": "待补充"
  },
  "mvp_scope": [
    "`feasibility=8`：实现可行性最高，适合首版落地。",
    "`speed=8`：上线速度最快，利于尽早验证真实用户需求。",
    "`cost=7`：首版建设成本相对可控。",
    "`risk=7`：总体风险低于依赖重建模或重协作体系的方案。",
    "从 brainstorm 看，原始需求虽然包含“多维参数 + 分层生成 + QA + 编辑”，但真正最容易形成差异化体验、也最适合首版验证的，是“可诊断、可改写、可回退、可对比”的编辑闭环。`solution_3` 对这部分覆盖最直接。",
    "与 `solution_1` 相比，`solution_3` 放弃了完整的分层流水线，但换来了更短的交付路径和更低的系统复杂度，更适合做第一阶段产品。",
    "与 `solution_2` 相比，`solution_3` 不强依赖角色状态推演、关系图谱和时间线引擎，避免首版陷入“建模很重、文本质量不稳定、用户输入门槛高”的风险。"
  ],
  "out_of_scope": [],
  "actors": [],
  "constraints": {
    "tech_stack": [
      "FastAPI",
      "pytest"
    ],
    "non_functional": {
      "security": [],
      "performance": [],
      "reliability": [],
      "observability": []
    }
  },
  "acceptance_criteria": [],
  "decision_artifacts": {
    "brainstorm_file": "specs/brainstorm/FEAT-0001.md",
    "scoring_file": "specs/scoring/FEAT-0001.json",
    "decision_file": "specs/decision/FEAT-0001.md"
  }
}