{
  "feature_id": "FEAT-0002",
  "raw_requirement": "在当前的项目上再添加一个会员系统",
  "selected_solution": {
    "id": "solution_2",
    "name": "成长积分型会员体系",
    "reason": "待补充"
  },
  "mvp_scope": [
    "`feasibility=8`：实现可行性高，不需要首期就建设复杂支付、企业计费或多 SKU 权益编排。",
    "`speed=8`：上线速度最快，适合先验证会员体系是否能带动活跃、留存和回访。",
    "`cost=7`：建设成本相对可控，能在较小范围内完成闭环。",
    "`risk=7`：总体风险低于支付驱动、社群冷启动和企业化重交付方案。",
    "从 brainstorm 看，当前输入只有“添加一个会员系统”，没有明确要求必须先做商业化收费。因此更合理的首版路径，是先用低门槛成长机制建立会员状态、权益触发和运营闭环，再决定是否叠加付费层。",
    "与 `solution_3`、`solution_5` 相比，`solution_2` 避免过早进入复杂商品化和 B 端组织能力建设，能把首版重心放在用户成长反馈、基础权益管理和运营可配置能力上。"
  ],
  "out_of_scope": [],
  "actors": [],
  "constraints": {
    "tech_stack": [
      "FastAPI",
      "pytest"
    ],
    "non_functional": {
      "security": [],
      "performance": [],
      "reliability": [],
      "observability": []
    }
  },
  "acceptance_criteria": [],
  "decision_artifacts": {
    "brainstorm_file": "specs/brainstorm/FEAT-0002.md",
    "scoring_file": "specs/scoring/FEAT-0002.json",
    "decision_file": "specs/decision/FEAT-0002.md"
  }
}